0.000000 0.000000 IP 192.168.10.201.47830 > 192.168.10.200.1234: Flags [S], seq 2005752396, win 29200, options [mss 1460,nop,nop,sackOK], length 0
0.000025 0.000025 IP 192.168.10.200.1234 > 192.168.10.201.47830: Flags [S.], seq 2199698152, ack 2005752397, win 64240, options [mss 1460,nop,nop,sackOK], length 0
0.000300 0.000275 IP 192.168.10.201.47830 > 192.168.10.200.1234: Flags [.], ack 1, win 29200, length 0
0.000908 0.000608 IP 192.168.10.200.1234 > 192.168.10.201.47830: Flags [P.], seq 1:1001, ack 1, win 64240, length 1000
0.001035 0.000127 IP 192.168.10.201.47830 > 192.168.10.200.1234: Flags [.], ack 1001, win 31000, length 0
1.001151 1.000116 IP 192.168.10.200.1234 > 192.168.10.201.47830: Flags [P.], seq 1001:2001, ack 1, win 64240, length 1000
1.001387 0.000236 IP 192.168.10.201.47830 > 192.168.10.200.1234: Flags [.], ack 2001, win 33000, length 0
2.001365 0.999978 IP 192.168.10.200.1234 > 192.168.10.201.47830: Flags [P.], seq 2001:3001, ack 1, win 64240, length 1000
2.001721 0.000356 IP 192.168.10.201.47830 > 192.168.10.200.1234: Flags [.], ack 3001, win 35000, length 0
3.001575 0.999854 IP 192.168.10.200.1234 > 192.168.10.201.47830: Flags [P.], seq 3001:4001, ack 1, win 64240, length 1000
3.001821 0.000246 IP 192.168.10.201.47830 > 192.168.10.200.1234: Flags [.], ack 4001, win 37000, length 0
4.001769 0.999948 IP 192.168.10.200.1234 > 192.168.10.201.47830: Flags [P.], seq 4001:5001, ack 1, win 64240, length 1000
4.001963 0.000194 IP 192.168.10.201.47830 > 192.168.10.200.1234: Flags [.], ack 5001, win 39000, length 0
5.001993 1.000030 IP 192.168.10.200.1234 > 192.168.10.201.47830: Flags [F.], seq 5001, ack 1, win 64240, length 0
5.002447 0.000454 IP 192.168.10.201.47830 > 192.168.10.200.1234: Flags [F.], seq 1, ack 5002, win 39000, length 0
5.002466 0.000019 IP 192.168.10.200.1234 > 192.168.10.201.47830: Flags [.], ack 2, win 64239, length 0
