0.000000 0.000000 IP 192.168.10.201.41200 > 192.168.10.200.1234: Flags [S], seq 974911953, win 29200, options [mss 1460,nop,nop,sackOK], length 0
0.000027 0.000027 IP 192.168.10.200.1234 > 192.168.10.201.41200: Flags [S.], seq 485040323, ack 974911954, win 64240, options [mss 1460,nop,nop,sackOK], length 0
0.000299 0.000272 IP 192.168.10.201.41200 > 192.168.10.200.1234: Flags [.], ack 1, win 29200, length 0
0.000848 0.000549 IP 192.168.10.200.1234 > 192.168.10.201.41200: Flags [P.], seq 1:101, ack 1, win 64240, length 100
0.000861 0.000013 IP 192.168.10.200.1234 > 192.168.10.201.41200: Flags [P.], seq 101:201, ack 1, win 64240, length 100
0.000872 0.000011 IP 192.168.10.200.1234 > 192.168.10.201.41200: Flags [P.], seq 201:301, ack 1, win 64240, length 100
0.000881 0.000009 IP 192.168.10.200.1234 > 192.168.10.201.41200: Flags [P.], seq 301:401, ack 1, win 64240, length 100
0.000891 0.000010 IP 192.168.10.200.1234 > 192.168.10.201.41200: Flags [P.], seq 401:501, ack 1, win 64240, length 100
0.000900 0.000009 IP 192.168.10.200.1234 > 192.168.10.201.41200: Flags [P.], seq 501:601, ack 1, win 64240, length 100
0.000910 0.000010 IP 192.168.10.200.1234 > 192.168.10.201.41200: Flags [P.], seq 601:701, ack 1, win 64240, length 100
0.000921 0.000011 IP 192.168.10.200.1234 > 192.168.10.201.41200: Flags [P.], seq 701:801, ack 1, win 64240, length 100
0.000931 0.000010 IP 192.168.10.200.1234 > 192.168.10.201.41200: Flags [P.], seq 801:901, ack 1, win 64240, length 100
0.000940 0.000009 IP 192.168.10.200.1234 > 192.168.10.201.41200: Flags [P.], seq 901:1001, ack 1, win 64240, length 100
0.001104 0.000164 IP 192.168.10.201.41200 > 192.168.10.200.1234: Flags [.], ack 101, win 29200, length 0
0.001105 0.000001 IP 192.168.10.201.41200 > 192.168.10.200.1234: Flags [.], ack 201, win 29200, length 0
0.001105 0.000000 IP 192.168.10.201.41200 > 192.168.10.200.1234: Flags [.], ack 401, win 30016, length 0
0.001106 0.000001 IP 192.168.10.201.41200 > 192.168.10.200.1234: Flags [.], ack 801, win 31088, length 0
0.001107 0.000001 IP 192.168.10.201.41200 > 192.168.10.200.1234: Flags [.], ack 1001, win 32160, length 0
1.001088 0.999981 IP 192.168.10.200.1234 > 192.168.10.201.41200: Flags [P.], seq 1001:1101, ack 1, win 64240, length 100
1.001104 0.000016 IP 192.168.10.200.1234 > 192.168.10.201.41200: Flags [P.], seq 1101:1201, ack 1, win 64240, length 100
1.001116 0.000012 IP 192.168.10.200.1234 > 192.168.10.201.41200: Flags [P.], seq 1201:1301, ack 1, win 64240, length 100
1.001126 0.000010 IP 192.168.10.200.1234 > 192.168.10.201.41200: Flags [P.], seq 1301:1401, ack 1, win 64240, length 100
1.001136 0.000010 IP 192.168.10.200.1234 > 192.168.10.201.41200: Flags [P.], seq 1401:1501, ack 1, win 64240, length 100
1.001146 0.000010 IP 192.168.10.200.1234 > 192.168.10.201.41200: Flags [P.], seq 1501:1601, ack 1, win 64240, length 100
1.001156 0.000010 IP 192.168.10.200.1234 > 192.168.10.201.41200: Flags [P.], seq 1601:1701, ack 1, win 64240, length 100
1.001166 0.000010 IP 192.168.10.200.1234 > 192.168.10.201.41200: Flags [P.], seq 1701:1801, ack 1, win 64240, length 100
1.001176 0.000010 IP 192.168.10.200.1234 > 192.168.10.201.41200: Flags [P.], seq 1801:1901, ack 1, win 64240, length 100
1.001186 0.000010 IP 192.168.10.200.1234 > 192.168.10.201.41200: Flags [P.], seq 1901:2001, ack 1, win 64240, length 100
1.001199 0.000013 IP 192.168.10.201.41200 > 192.168.10.200.1234: Flags [.], ack 1101, win 32160, length 0
1.001200 0.000001 IP 192.168.10.201.41200 > 192.168.10.200.1234: Flags [.], ack 1201, win 32160, length 0
1.001258 0.000058 IP 192.168.10.201.41200 > 192.168.10.200.1234: Flags [.], ack 1301, win 32160, length 0
1.001259 0.000001 IP 192.168.10.201.41200 > 192.168.10.200.1234: Flags [.], ack 1801, win 33232, length 0
1.001285 0.000026 IP 192.168.10.201.41200 > 192.168.10.200.1234: Flags [.], ack 1901, win 33232, length 0
1.001286 0.000001 IP 192.168.10.201.41200 > 192.168.10.200.1234: Flags [.], ack 2001, win 33232, length 0
2.001334 1.000048 IP 192.168.10.200.1234 > 192.168.10.201.41200: Flags [P.], seq 2001:2101, ack 1, win 64240, length 100
2.001350 0.000016 IP 192.168.10.200.1234 > 192.168.10.201.41200: Flags [P.], seq 2101:2201, ack 1, win 64240, length 100
2.001363 0.000013 IP 192.168.10.200.1234 > 192.168.10.201.41200: Flags [P.], seq 2201:2301, ack 1, win 64240, length 100
2.001373 0.000010 IP 192.168.10.200.1234 > 192.168.10.201.41200: Flags [P.], seq 2301:2401, ack 1, win 64240, length 100
2.001383 0.000010 IP 192.168.10.200.1234 > 192.168.10.201.41200: Flags [P.], seq 2401:2501, ack 1, win 64240, length 100
2.001393 0.000010 IP 192.168.10.200.1234 > 192.168.10.201.41200: Flags [P.], seq 2501:2601, ack 1, win 64240, length 100
2.001404 0.000011 IP 192.168.10.200.1234 > 192.168.10.201.41200: Flags [P.], seq 2601:2701, ack 1, win 64240, length 100
2.001413 0.000009 IP 192.168.10.200.1234 > 192.168.10.201.41200: Flags [P.], seq 2701:2801, ack 1, win 64240, length 100
2.001423 0.000010 IP 192.168.10.200.1234 > 192.168.10.201.41200: Flags [P.], seq 2801:2901, ack 1, win 64240, length 100
2.001432 0.000009 IP 192.168.10.200.1234 > 192.168.10.201.41200: Flags [P.], seq 2901:3001, ack 1, win 64240, length 100
2.001534 0.000102 IP 192.168.10.201.41200 > 192.168.10.200.1234: Flags [.], ack 2101, win 33232, length 0
2.001535 0.000001 IP 192.168.10.201.41200 > 192.168.10.200.1234: Flags [.], ack 2201, win 33232, length 0
2.001535 0.000000 IP 192.168.10.201.41200 > 192.168.10.200.1234: Flags [.], ack 2301, win 33232, length 0
2.001536 0.000001 IP 192.168.10.201.41200 > 192.168.10.200.1234: Flags [.], ack 2401, win 33232, length 0
2.001537 0.000001 IP 192.168.10.201.41200 > 192.168.10.200.1234: Flags [.], ack 2501, win 33232, length 0
2.001584 0.000047 IP 192.168.10.201.41200 > 192.168.10.200.1234: Flags [.], ack 2601, win 33232, length 0
2.001585 0.000001 IP 192.168.10.201.41200 > 192.168.10.200.1234: Flags [.], ack 3001, win 34304, length 0
3.001580 0.999995 IP 192.168.10.200.1234 > 192.168.10.201.41200: Flags [P.], seq 3001:3101, ack 1, win 64240, length 100
3.001596 0.000016 IP 192.168.10.200.1234 > 192.168.10.201.41200: Flags [P.], seq 3101:3201, ack 1, win 64240, length 100
3.001608 0.000012 IP 192.168.10.200.1234 > 192.168.10.201.41200: Flags [P.], seq 3201:3301, ack 1, win 64240, length 100
3.001617 0.000009 IP 192.168.10.200.1234 > 192.168.10.201.41200: Flags [P.], seq 3301:3401, ack 1, win 64240, length 100
3.001627 0.000010 IP 192.168.10.200.1234 > 192.168.10.201.41200: Flags [P.], seq 3401:3501, ack 1, win 64240, length 100
3.001637 0.000010 IP 192.168.10.200.1234 > 192.168.10.201.41200: Flags [P.], seq 3501:3601, ack 1, win 64240, length 100
3.001646 0.000009 IP 192.168.10.200.1234 > 192.168.10.201.41200: Flags [P.], seq 3601:3701, ack 1, win 64240, length 100
3.001656 0.000010 IP 192.168.10.200.1234 > 192.168.10.201.41200: Flags [P.], seq 3701:3801, ack 1, win 64240, length 100
3.001666 0.000010 IP 192.168.10.200.1234 > 192.168.10.201.41200: Flags [P.], seq 3801:3901, ack 1, win 64240, length 100
3.001676 0.000010 IP 192.168.10.200.1234 > 192.168.10.201.41200: Flags [P.], seq 3901:4001, ack 1, win 64240, length 100
3.001793 0.000117 IP 192.168.10.201.41200 > 192.168.10.200.1234: Flags [.], ack 3101, win 34304, length 0
3.001794 0.000001 IP 192.168.10.201.41200 > 192.168.10.200.1234: Flags [.], ack 3201, win 34304, length 0
3.001795 0.000001 IP 192.168.10.201.41200 > 192.168.10.200.1234: Flags [.], ack 3301, win 34304, length 0
3.001795 0.000000 IP 192.168.10.201.41200 > 192.168.10.200.1234: Flags [.], ack 4001, win 35912, length 0
4.001855 1.000060 IP 192.168.10.200.1234 > 192.168.10.201.41200: Flags [P.], seq 4001:4101, ack 1, win 64240, length 100
4.001867 0.000012 IP 192.168.10.200.1234 > 192.168.10.201.41200: Flags [P.], seq 4101:4201, ack 1, win 64240, length 100
4.001878 0.000011 IP 192.168.10.200.1234 > 192.168.10.201.41200: Flags [P.], seq 4201:4301, ack 1, win 64240, length 100
4.001888 0.000010 IP 192.168.10.200.1234 > 192.168.10.201.41200: Flags [P.], seq 4301:4401, ack 1, win 64240, length 100
4.001898 0.000010 IP 192.168.10.200.1234 > 192.168.10.201.41200: Flags [P.], seq 4401:4501, ack 1, win 64240, length 100
4.001908 0.000010 IP 192.168.10.200.1234 > 192.168.10.201.41200: Flags [P.], seq 4501:4601, ack 1, win 64240, length 100
4.001918 0.000010 IP 192.168.10.200.1234 > 192.168.10.201.41200: Flags [P.], seq 4601:4701, ack 1, win 64240, length 100
4.001927 0.000009 IP 192.168.10.200.1234 > 192.168.10.201.41200: Flags [P.], seq 4701:4801, ack 1, win 64240, length 100
4.001937 0.000010 IP 192.168.10.200.1234 > 192.168.10.201.41200: Flags [P.], seq 4801:4901, ack 1, win 64240, length 100
4.001946 0.000009 IP 192.168.10.200.1234 > 192.168.10.201.41200: Flags [P.], seq 4901:5001, ack 1, win 64240, length 100
4.002034 0.000088 IP 192.168.10.201.41200 > 192.168.10.200.1234: Flags [.], ack 4101, win 35912, length 0
4.002035 0.000001 IP 192.168.10.201.41200 > 192.168.10.200.1234: Flags [.], ack 4201, win 35912, length 0
4.002153 0.000118 IP 192.168.10.201.41200 > 192.168.10.200.1234: Flags [.], ack 4301, win 35912, length 0
4.002154 0.000001 IP 192.168.10.201.41200 > 192.168.10.200.1234: Flags [.], ack 5001, win 36984, length 0
5.002198 1.000044 IP 192.168.10.200.1234 > 192.168.10.201.41200: Flags [F.], seq 5001, ack 1, win 64240, length 0
5.002597 0.000399 IP 192.168.10.201.41200 > 192.168.10.200.1234: Flags [F.], seq 1, ack 5002, win 36984, length 0
5.002617 0.000020 IP 192.168.10.200.1234 > 192.168.10.201.41200: Flags [.], ack 2, win 64239, length 0
