0.000000 0.000000 IP 192.168.10.201.45628 > 192.168.10.200.1234: Flags [S], seq 2040766054, win 29200, options [mss 1460,nop,nop,sackOK], length 0
0.000026 0.000026 IP 192.168.10.200.1234 > 192.168.10.201.45628: Flags [S.], seq 332823371, ack 2040766055, win 64240, options [mss 1460,nop,nop,sackOK], length 0
0.000160 0.000134 IP 192.168.10.201.45628 > 192.168.10.200.1234: Flags [.], ack 1, win 29200, length 0
0.000777 0.000617 IP 192.168.10.200.1234 > 192.168.10.201.45628: Flags [P.], seq 1:101, ack 1, win 64240, length 100
0.000995 0.000218 IP 192.168.10.201.45628 > 192.168.10.200.1234: Flags [.], ack 101, win 29200, length 0
0.001011 0.000016 IP 192.168.10.200.1234 > 192.168.10.201.45628: Flags [P.], seq 101:1001, ack 1, win 64240, length 900
0.001252 0.000241 IP 192.168.10.201.45628 > 192.168.10.200.1234: Flags [.], ack 1001, win 30600, length 0
1.001016 0.999764 IP 192.168.10.200.1234 > 192.168.10.201.45628: Flags [P.], seq 1001:1101, ack 1, win 64240, length 100
1.001171 0.000155 IP 192.168.10.201.45628 > 192.168.10.200.1234: Flags [.], ack 1101, win 30600, length 0
1.001186 0.000015 IP 192.168.10.200.1234 > 192.168.10.201.45628: Flags [P.], seq 1101:2001, ack 1, win 64240, length 900
1.001386 0.000200 IP 192.168.10.201.45628 > 192.168.10.200.1234: Flags [.], ack 2001, win 32400, length 0
2.001254 0.999868 IP 192.168.10.200.1234 > 192.168.10.201.45628: Flags [P.], seq 2001:2101, ack 1, win 64240, length 100
2.001479 0.000225 IP 192.168.10.201.45628 > 192.168.10.200.1234: Flags [.], ack 2101, win 32400, length 0
2.001494 0.000015 IP 192.168.10.200.1234 > 192.168.10.201.45628: Flags [P.], seq 2101:3001, ack 1, win 64240, length 900
2.001627 0.000133 IP 192.168.10.201.45628 > 192.168.10.200.1234: Flags [.], ack 3001, win 34200, length 0
3.001495 0.999868 IP 192.168.10.200.1234 > 192.168.10.201.45628: Flags [P.], seq 3001:3101, ack 1, win 64240, length 100
3.001767 0.000272 IP 192.168.10.201.45628 > 192.168.10.200.1234: Flags [.], ack 3101, win 34200, length 0
3.001783 0.000016 IP 192.168.10.200.1234 > 192.168.10.201.45628: Flags [P.], seq 3101:4001, ack 1, win 64240, length 900
3.001963 0.000180 IP 192.168.10.201.45628 > 192.168.10.200.1234: Flags [.], ack 4001, win 36000, length 0
4.001731 0.999768 IP 192.168.10.200.1234 > 192.168.10.201.45628: Flags [P.], seq 4001:4101, ack 1, win 64240, length 100
4.001863 0.000132 IP 192.168.10.201.45628 > 192.168.10.200.1234: Flags [.], ack 4101, win 36000, length 0
4.001877 0.000014 IP 192.168.10.200.1234 > 192.168.10.201.45628: Flags [P.], seq 4101:5001, ack 1, win 64240, length 900
4.002075 0.000198 IP 192.168.10.201.45628 > 192.168.10.200.1234: Flags [.], ack 5001, win 37800, length 0
5.002105 1.000030 IP 192.168.10.200.1234 > 192.168.10.201.45628: Flags [F.], seq 5001, ack 1, win 64240, length 0
5.002630 0.000525 IP 192.168.10.201.45628 > 192.168.10.200.1234: Flags [F.], seq 1, ack 5002, win 37800, length 0
5.002646 0.000016 IP 192.168.10.200.1234 > 192.168.10.201.45628: Flags [.], ack 2, win 64239, length 0
